<!ELEMENT listaventas (venta*)>
<!ELEMENT venta (importe, fecha, venedor , comprador, codFac)>
<!ELEMENT importe (#PCDATA)>
<!ELEMENT fecha (#PCDATA)>
<!ELEMENT venedor (#PCDATA)>
<!ELEMENT comprador (#PCDATA)>
<!ELEMENT codFac (#PCDATA)>
